{
  "schema_version": "2.1.0",
  "research_id": "RR-C0037-FOREIGN",
  "card_id": "C0037",
  "candidate": {
    "term": "甘え",
    "language_code": "ja-JP",
    "language_name": "日本語",
    "experience_type": "relational_experience"
  },
  "lifecycle_state": "HOLD",
  "source_inventory": [
    {
      "reference_id": "R0159",
      "role": "lexical",
      "quality_tier": "A"
    },
    {
      "reference_id": "R0160",
      "role": "scholarly",
      "quality_tier": "A"
    },
    {
      "reference_id": "R0161",
      "role": "pronunciation",
      "quality_tier": "B"
    }
  ],
  "lexical_verification": {
    "status": "PASS",
    "summary": "원어 권위 사전에서 목표 표제어와 카드에 사용할 의미 범위를 확인했다.",
    "reference_ids": [
      "R0159"
    ]
  },
  "semantic_definition_and_boundaries": {
    "status": "PASS",
    "summary": "한국어의 응석·어리광·애교는 행동 일부를 가리킬 수 있지만, 상대의 호의와 수용을 전제로 의존하려는 심리적 기대와 관계적 기능까지 한 단어로 묶지는 않는다. 한국 연구도 amae에 대응하는 단일 한국어가 없고 여러 표현으로 번역된다고 직접 지적한다.",
    "reference_ids": [
      "R0159",
      "R0160"
    ]
  },
  "cultural_context_review": {
    "status": "PASS",
    "summary": "언어·문화 맥락을 설명하되 해당 문화 사람만 이 경험을 느낀다는 본질주의나 번역불가능성 주장을 하지 않는다.",
    "reference_ids": [
      "R0159",
      "R0160"
    ]
  },
  "comparisons": {
    "ko": {
      "status": "PASS",
      "near_terms": [
        "응석",
        "어리광",
        "애교",
        "상대가 받아줄 거라 믿고 기대는 마음"
      ],
      "difference_note": "한국어 근접어 하나로는 핵심 의미 패키지를 모두 보존하기 어렵다.",
      "verification_note": "Korean Expression Cost review PASS.",
      "reference_ids": [
        "R0159",
        "R0160"
      ]
    },
    "en": {
      "status": "HOLD",
      "near_terms": [
        "dependence expecting acceptance",
        "indulgent reliance",
        "presuming on another's goodwill"
      ],
      "difference_note": "영어 근접어는 provisional이며 독립 lexical verification 전에는 최종 비교로 승격하지 않는다.",
      "verification_note": "Research-stage provisional mapping.",
      "reference_ids": [
        "R0159"
      ]
    },
    "zh": {
      "status": "HOLD",
      "near_terms": [
        "依赖并期待对方包容",
        "撒娇式依赖",
        "仗着对方好意而依赖"
      ],
      "difference_note": "원어가 중국어이면 target lexical evidence로 자체 의미를 확인했고, 그 외에는 provisional이다.",
      "verification_note": "Target-language evidence or provisional mapping.",
      "reference_ids": [
        "R0159"
      ]
    },
    "ja": {
      "status": "PASS",
      "near_terms": [
        "人の好意をあてにする気持ち",
        "受け入れてもらえることを期待する依存"
      ],
      "difference_note": "일본어 근접어는 provisional이며 독립 lexical verification 전에는 최종 비교로 승격하지 않는다.",
      "verification_note": "Research-stage provisional mapping.",
      "reference_ids": [
        "R0159"
      ]
    }
  },
  "pronunciation_verification": {
    "status": "HOLD",
    "ipa": "[a̠ma̠e̞]",
    "locale": "ja-JP",
    "reference_ids": [
      "R0161"
    ],
    "audio_asset_id": null,
    "notes": "IPA/transliteration provenance is recorded, but exact product-safe audio source, creator, locale fit, license, rights, and SHA linkage are not yet verified."
  },
  "claim_source_map": [
    {
      "claim_id": "CL-001",
      "claim": "한국어의 응석·어리광·애교는 행동 일부를 가리킬 수 있지만, 상대의 호의와 수용을 전제로 의존하려는 심리적 기대와 관계적 기능까지 한 단어로 묶지는 않는다. 한국 연구도 amae에 대응하는 단일 한국어가 없고 여러 표현으로 번역된다고 직접 지적한다.",
      "reference_ids": [
        "R0159",
        "R0160"
      ],
      "evidence_locator": "Target lexical definition plus directly relevant scholarly evidence.",
      "public_safe": true
    },
    {
      "claim_id": "CL-002",
      "claim": "한국어의 흔한 한 단어 하나로는 핵심 의미 패키지를 모두 보존하기 어렵다.",
      "reference_ids": [
        "R0159",
        "R0160"
      ],
      "evidence_locator": "Korean Expression Cost review against target semantic components.",
      "public_safe": true
    }
  ],
  "relations": [],
  "illustration_brief": {
    "status": "HOLD",
    "summary": "Product audio rights and full multilingual comparison are incomplete; illustration is deferred.",
    "reference_ids": [
      "R0159"
    ]
  },
  "editorial_copy": {
    "status": "HOLD",
    "summary": "Public poetic copy is deferred until all gates can be evaluated together.",
    "reference_ids": [
      "R0159",
      "R0160"
    ]
  },
  "automated_gates": {
    "schema": "PASS",
    "evidence": "PASS",
    "pronunciation": "HOLD",
    "cultural_humility": "PASS",
    "rights": "HOLD",
    "privacy": "PASS"
  },
  "distinctiveness_review": {
    "status": "PASS",
    "track": "FOREIGN_KOREAN_GAP",
    "generic_basic_emotion": false,
    "nearest_cross_language_terms": {
      "ko": [
        "응석",
        "어리광",
        "애교",
        "상대가 받아줄 거라 믿고 기대는 마음"
      ],
      "en": [
        "dependence expecting acceptance",
        "indulgent reliance",
        "presuming on another's goodwill"
      ],
      "zh": [
        "依赖并期待对方包容",
        "撒娇式依赖",
        "仗着对方好意而依赖"
      ],
      "ja": [
        "人の好意をあてにする気持ち",
        "受け入れてもらえることを期待する依存"
      ]
    },
    "semantic_residue": "한국어의 응석·어리광·애교는 행동 일부를 가리킬 수 있지만, 상대의 호의와 수용을 전제로 의존하려는 심리적 기대와 관계적 기능까지 한 단어로 묶지는 않는다. 한국 연구도 amae에 대응하는 단일 한국어가 없고 여러 표현으로 번역된다고 직접 지적한다.",
    "residue_reference_ids": [
      "R0159",
      "R0160"
    ],
    "overclaim_to_avoid": "일본인만 느끼는 고유 감정이라고 주장하지 않고, 모든 甘え를 유아적 의존이나 부정적 미성숙으로 고정하지 않는다.",
    "korean_expression_cost": {
      "classification": "EXPLANATORY_PHRASE_REQUIRED",
      "status": "PASS",
      "nearest_korean_terms": [
        "응석",
        "어리광",
        "애교",
        "상대가 받아줄 거라 믿고 기대는 마음"
      ],
      "natural_korean_rendering": "상대가 나를 받아주고 특별히 너그럽게 대해 줄 것이라는 관계적 믿음 위에서 의존하거나 응석을 부리고, 그 호의를 기대해도 괜찮다고 느끼는 마음과 행동",
      "residue_dimensions": [
        "reliance on another's goodwill",
        "expectation of acceptance",
        "dependent/indulgent relational stance",
        "can extend beyond child-parent relations"
      ],
      "reference_ids": [
        "R0159",
        "R0160"
      ],
      "rationale": "한국어의 흔한 한 단어가 의미 전체를 보존하는지 먼저 검토했다. 이 후보는 핵심 의미 요소가 여러 한국어 표현으로 분산되거나 설명적 구가 필요하며, 원어 사전과 직접 관련 학술 근거가 그 의미 잔여를 뒷받침한다."
    }
  },
  "human_editorial_release": {
    "status": "PENDING",
    "reviewer": null,
    "reviewed_at": null,
    "notes": "Research-stage HOLD. Human Editorial Release is not open until product audio rights and full multilingual comparison pass."
  },
  "changelog": [
    {
      "date": "2026-09-17",
      "state": "RESEARCH",
      "note": "Foreign semantic-gap source-first research under v2.1 Korean Expression Cost contract."
    },
    {
      "date": "2026-09-17",
      "state": "HOLD",
      "note": "Core semantic gap passes; product audio rights and full multilingual comparison remain incomplete."
    }
  ]
}
