{
  "schema_version": "2.1.0",
  "research_id": "RR-C0022-FOREIGN",
  "card_id": "C0022",
  "candidate": {
    "term": "舍不得",
    "language_code": "zh-CN",
    "language_name": "中文",
    "experience_type": "relational_experience"
  },
  "lifecycle_state": "HOLD",
  "source_inventory": [
    {
      "reference_id": "R0114",
      "role": "lexical",
      "quality_tier": "A"
    },
    {
      "reference_id": "R0115",
      "role": "scholarly",
      "quality_tier": "A"
    },
    {
      "reference_id": "R0116",
      "role": "pronunciation",
      "quality_tier": "B"
    }
  ],
  "lexical_verification": {
    "status": "PASS",
    "summary": "원어 권위 사전에서 목표 표제어와 카드에 사용할 의미 범위를 확인했다.",
    "reference_ids": [
      "R0114"
    ]
  },
  "semantic_definition_and_boundaries": {
    "status": "PASS",
    "summary": "한국어에서는 헤어짐에는 아쉽다, 물건에는 아깝다, 관계에는 놓아주기 싫다처럼 문맥에 따라 표현이 갈리지만 舍不得은 애착 때문에 분리·포기·사용을 꺼리는 공통 구조를 한 표현으로 묶는다.",
    "reference_ids": [
      "R0114",
      "R0115"
    ]
  },
  "cultural_context_review": {
    "status": "PASS",
    "summary": "언어·문화 맥락을 설명하되 해당 문화 사람만 이 경험을 느낀다는 본질주의나 번역불가능성 주장을 하지 않는다.",
    "reference_ids": [
      "R0114",
      "R0115"
    ]
  },
  "comparisons": {
    "ko": {
      "status": "PASS",
      "near_terms": [
        "헤어지기 아쉽다",
        "아까워서 버리지 못하다",
        "놓아주기 싫다"
      ],
      "difference_note": "한국어 근접어 하나로는 핵심 의미 패키지를 모두 보존하기 어렵다.",
      "verification_note": "Korean Expression Cost review PASS.",
      "reference_ids": [
        "R0114",
        "R0115"
      ]
    },
    "en": {
      "status": "HOLD",
      "near_terms": [
        "cannot bear to part with",
        "reluctant to give up or use"
      ],
      "difference_note": "영어 근접어는 provisional이며 독립 lexical verification 전에는 최종 비교로 승격하지 않는다.",
      "verification_note": "Research-stage provisional mapping.",
      "reference_ids": [
        "R0114"
      ]
    },
    "zh": {
      "status": "PASS",
      "near_terms": [
        "不忍分离",
        "因爱惜而不忍割舍"
      ],
      "difference_note": "원어가 중국어이면 target lexical evidence로 자체 의미를 확인했고, 그 외에는 provisional이다.",
      "verification_note": "Target-language evidence or provisional mapping.",
      "reference_ids": [
        "R0114"
      ]
    },
    "ja": {
      "status": "HOLD",
      "near_terms": [
        "手放すのが惜しい",
        "別れるのがつらい"
      ],
      "difference_note": "일본어 근접어는 provisional이며 독립 lexical verification 전에는 최종 비교로 승격하지 않는다.",
      "verification_note": "Research-stage provisional mapping.",
      "reference_ids": [
        "R0114"
      ]
    }
  },
  "pronunciation_verification": {
    "status": "HOLD",
    "ipa": "[ʂɤ²¹⁴ pu⁴ tə¹]",
    "locale": "zh-CN",
    "reference_ids": [
      "R0116"
    ],
    "audio_asset_id": null,
    "notes": "IPA/transliteration provenance is recorded, but exact product-safe audio source, creator, locale fit, license, rights, and SHA linkage are not yet verified."
  },
  "claim_source_map": [
    {
      "claim_id": "CL-001",
      "claim": "한국어에서는 헤어짐에는 아쉽다, 물건에는 아깝다, 관계에는 놓아주기 싫다처럼 문맥에 따라 표현이 갈리지만 舍不得은 애착 때문에 분리·포기·사용을 꺼리는 공통 구조를 한 표현으로 묶는다.",
      "reference_ids": [
        "R0114",
        "R0115"
      ],
      "evidence_locator": "Target lexical definition plus directly relevant scholarly evidence.",
      "public_safe": true
    },
    {
      "claim_id": "CL-002",
      "claim": "한국어의 흔한 한 단어 하나로는 핵심 의미 패키지를 모두 보존하기 어렵다.",
      "reference_ids": [
        "R0114",
        "R0115"
      ],
      "evidence_locator": "Korean Expression Cost review against target semantic components.",
      "public_safe": true
    }
  ],
  "relations": [],
  "illustration_brief": {
    "status": "HOLD",
    "summary": "Product audio rights and full multilingual comparison are incomplete; illustration is deferred.",
    "reference_ids": [
      "R0114"
    ]
  },
  "editorial_copy": {
    "status": "HOLD",
    "summary": "Public poetic copy is deferred until all gates can be evaluated together.",
    "reference_ids": [
      "R0114",
      "R0115"
    ]
  },
  "automated_gates": {
    "schema": "PASS",
    "evidence": "PASS",
    "pronunciation": "HOLD",
    "cultural_humility": "PASS",
    "rights": "HOLD",
    "privacy": "PASS"
  },
  "distinctiveness_review": {
    "status": "PASS",
    "track": "FOREIGN_KOREAN_GAP",
    "generic_basic_emotion": false,
    "nearest_cross_language_terms": {
      "ko": [
        "헤어지기 아쉽다",
        "아까워서 버리지 못하다",
        "놓아주기 싫다"
      ],
      "en": [
        "cannot bear to part with",
        "reluctant to give up or use"
      ],
      "zh": [
        "不忍分离",
        "因爱惜而不忍割舍"
      ],
      "ja": [
        "手放すのが惜しい",
        "別れるのがつらい"
      ]
    },
    "semantic_residue": "한국어에서는 헤어짐에는 아쉽다, 물건에는 아깝다, 관계에는 놓아주기 싫다처럼 문맥에 따라 표현이 갈리지만 舍不得은 애착 때문에 분리·포기·사용을 꺼리는 공통 구조를 한 표현으로 묶는다.",
    "residue_reference_ids": [
      "R0114",
      "R0115"
    ],
    "overclaim_to_avoid": "중국 문화가 유독 관계에 집착한다는 식으로 문화적 성격을 일반화하지 않는다.",
    "korean_expression_cost": {
      "classification": "EXPLANATORY_PHRASE_REQUIRED",
      "status": "PASS",
      "nearest_korean_terms": [
        "헤어지기 아쉽다",
        "아까워서 버리지 못하다",
        "놓아주기 싫다"
      ],
      "natural_korean_rendering": "소중하거나 아끼는 사람·장소·물건이라서 헤어지거나 놓거나 버리거나 써버리기가 마음에 걸리고 싫은 느낌",
      "residue_dimensions": [
        "attachment/value",
        "reluctance to part",
        "reluctance to give up/discard/use",
        "emotional difficulty of letting go"
      ],
      "reference_ids": [
        "R0114",
        "R0115"
      ],
      "rationale": "한국어의 흔한 한 단어가 의미 전체를 보존하는지 먼저 검토했다. 이 후보는 핵심 의미 요소가 여러 한국어 표현으로 분산되거나 설명적 구가 필요하며, 원어 사전과 직접 관련 학술 근거가 그 의미 잔여를 뒷받침한다."
    }
  },
  "human_editorial_release": {
    "status": "PENDING",
    "reviewer": null,
    "reviewed_at": null,
    "notes": "Research-stage HOLD. Human Editorial Release is not open until product audio rights and full multilingual comparison pass."
  },
  "changelog": [
    {
      "date": "2026-09-17",
      "state": "RESEARCH",
      "note": "Foreign semantic-gap source-first research under v2.1 Korean Expression Cost contract."
    },
    {
      "date": "2026-09-17",
      "state": "HOLD",
      "note": "Core semantic gap passes; product audio rights and full multilingual comparison remain incomplete."
    }
  ]
}
